### ISSUE TITLE
[Bug] Multi host 2x8*H100 hangs before weights loading [IPv6]

### ISSUE THREAD

**Issue by human-research** [sgl-project/sglang#7478]
### Checklist

- [x] 1. I have searched related issues but cannot get the expected help.
- [x] 2. The bug has not been fixed in the latest version.
- [x] 3. Please note that if the bug-related issue you submitted lacks corresponding environment info and a minimal reproducible demo, it will be challenging for us to reproduce and resolve the issue, reducing the likelihood of receiving feedback.
- [x] 4. If the issue you raised is not a bug but a question, please raise a discussion at https://github.com/sgl-project/sglang/discussions/new/choose Otherwise, it will be closed.
- [x] 5. Please use English, otherwise it will be closed.

### Describe the bug

Hello. I have a hang in loading SGLang with Deepseek R1 671B weights. 
I'm using Docker in pure IPv6 environment.

Node0:
```
+ python3 -m sglang.launch_server --model /place/deepseek-r1/weights --served-model-name deepseek-r1 --chunked-prefill-size 4096 --context-length 32768 --skip-tokenizer-init --enable-mixed-chunk --disable-radix-cache --tp 16 --dist-init-addr node-0.company.net:20000 --nnodes 2 --node-rank 0 --trust-remote-code --host :: --port 40000 --log-level=debug
[2025-06-23 15:06:04] Setting Triton cache manager to: sglang.srt.utils:CustomCacheManager
[2025-06-23 15:06:04] server_args=ServerArgs(model_path='/place/deepseek-r1/weights', tokenizer_path='/place/deepseek-r1/weights', tokenizer_mode='auto', skip_tokenizer_init=True, load_format='auto', trust_remote_code=True, dtype='auto', kv_cache_dtype='auto', quantization=None, quantization_param_path=None, context_length=32768, device='cuda', served_model_name='deepseek-r1', chat_template=None, completion_template=None, is_embedding=False, enable_multimodal=None, revision=None, impl='auto', host='::', port=40000, mem_fraction_static=0.78, max_running_requests=None, max_total_tokens=None, chunked_prefill_size=4096, max_prefill_tokens=16384, schedule_policy='fcfs', schedule_conservativeness=1.0, cpu_offload_gb=0, page_size=1, tp_size=16, pp_size=1, max_micro_batch_size=None, stream_interval=1, stream_output=False, random_seed=133233050, constrained_json_whitespace_pattern=None, watchdog_timeout=300, dist_timeout=None, download_dir=None, base_gpu_id=0, gpu_id_step=1, sleep_on_idle=False, log_level='debug', log_level_http=None, log_requests=False, log_requests_level=0, show_time_cost=False, enable_metrics=False, bucket_time_to_first_token=None, bucket_e2e_request_latency=None, bucket_inter_token_latency=None, collect_tokens_histogram=False, decode_log_interval=40, enable_request_time_stats_logging=False, kv_events_config=None, api_key=None, file_storage_path='sglang_storage', enable_cache_report=False, reasoning_parser=None, tool_call_parser=None, dp_size=1, load_balance_method='round_robin', dist_init_addr='node-0.company.net:20000', nnodes=2, node_rank=0, json_model_override_args='{}', preferred_sampling_params=None, lora_paths=None, max_loras_per_batch=8, lora_backend='triton', attention_backend=None, sampling_backend='flashinfer', grammar_backend='xgrammar', mm_attention_backend=None, speculative_algorithm=None, speculative_draft_model_path=None, speculative_num_steps=None, speculative_eagle_topk=None, speculative_num_draft_tokens=None, speculative_accept_threshold_single=1.0, speculative_accept_threshold_acc=1.0, speculative_token_map=None, ep_size=1, enable_ep_moe=False, enable_deepep_moe=False, deepep_mode='auto', ep_num_redundant_experts=0, ep_dispatch_algorithm='static', init_expert_location='trivial', enable_eplb=False, eplb_algorithm='auto', eplb_rebalance_num_iterations=1000, eplb_rebalance_layers_per_chunk=None, expert_distribution_recorder_mode=None, expert_distribution_recorder_buffer_size=1000, enable_expert_distribution_metrics=False, deepep_config=None, moe_dense_tp_size=None, enable_double_sparsity=False, ds_channel_config_path=None, ds_heavy_channel_num=32, ds_heavy_token_num=256, ds_heavy_channel_type='qk', ds_sparse_decode_threshold=4096, disable_radix_cache=True, cuda_graph_max_bs=None, cuda_graph_bs=None, disable_cuda_graph=False, disable_cuda_graph_padding=False, enable_profile_cuda_graph=False, enable_nccl_nvls=False, enable_tokenizer_batch_encode=False, disable_outlines_disk_cache=False, disable_custom_all_reduce=False, enable_mscclpp=False, disable_overlap_schedule=False, disable_overlap_cg_plan=False, enable_mixed_chunk=True, enable_dp_attention=False, enable_dp_lm_head=False, enable_two_batch_overlap=False, enable_torch_compile=False, torch_compile_max_bs=32, torchao_config='', enable_nan_detection=False, enable_p2p_check=False, triton_attention_reduce_in_fp32=False, triton_attention_num_kv_splits=8, num_continuous_decode_steps=1, delete_ckpt_after_loading=False, enable_memory_saver=False, allow_auto_truncate=False, enable_custom_logit_processor=False, enable_hierarchical_cache=False, hicache_ratio=2.0, hicache_size=0, hicache_write_policy='write_through_selective', flashinfer_mla_disable_ragged=False, disable_shared_experts_fusion=False, disable_chunked_prefix_cache=False, disable_fast_image_processor=False, enable_return_hidden_states=False, warmups=None, debug_tensor_dump_output_folder=None, debug_tensor_dump_input_file=None, debug_tensor_dump_inject=False, debug_tensor_dump_prefill_only=False, disaggregation_mode='null', disaggregation_transfer_backend='mooncake', disaggregation_bootstrap_port=8998, disaggregation_decode_tp=None, disaggregation_decode_dp=None, disaggregation_prefill_pp=1, disaggregation_ib_device=None, num_reserved_decode_tokens=512, pdlb_url=None)
[2025-06-23 15:06:09 TP1] world_size=16 rank=1 local_rank=1 distributed_init_method=tcp://node-0.company.net:20000 backend=nccl
[2025-06-23 15:06:09 TP2] world_size=16 rank=2 local_rank=2 distributed_init_method=tcp://node-0.company.net:20000 backend=nccl
[2025-06-23 15:06:10 TP6] world_size=16 rank=6 local_rank=6 distributed_init_method=tcp://node-0.company.net:20000 backend=nccl
[2025-06-23 15:06:10 TP0] Attention backend not set. Use fa3 backend by default.
[2025-06-23 15:06:10 TP0] Chunked prefix cache is turned on.
[2025-06-23 15:06:10 TP0] Init torch distributed begin.
[2025-06-23 15:06:10 TP3] world_size=16 rank=3 local_rank=3 distributed_init_method=tcp://node-0.company.net:20000 backend=nccl
[2025-06-23 15:06:10 TP4] world_size=16 rank=4 local_rank=4 distributed_init_method=tcp://node-0.company.net:20000 backend=nccl
[2025-06-23 15:06:10 TP0] world_size=16 rank=0 local_rank=0 distributed_init_method=tcp://node-0.company.net:20000 backend=nccl
[2025-06-23 15:06:10 TP7] world_size=16 rank=7 local_rank=7 distributed_init_method=tcp://node-0.company.net:20000 backend=nccl
[2025-06-23 15:06:10 TP5] world_size=16 rank=5 local_rank=5 distributed_init_method=tcp://node-0.company.net:20000 backend=nccl
[2025-06-23 15:06:59 TP0] Found nccl from library libnccl.so.2
[2025-06-23 15:06:59 TP0] sglang is using nccl==2.26.2
node-0:270:270 [0] NCCL INFO NCCL_SOCKET_IFNAME set by environment to enx
node-0:270:270 [0] NCCL INFO Bootstrap: Using enxa088c2393978:2a02:6b8:c41:229:0:604:c239:3978<0>
[2025-06-23 15:06:59 TP1] Found nccl from library libnccl.so.2
[2025-06-23 15:06:59 TP2] Found nccl from library libnccl.so.2
[2025-06-23 15:06:59 TP3] Found nccl from library libnccl.so.2
[2025-06-23 15:06:59 TP7] Found nccl from library libnccl.so.2
[2025-06-23 15:06:59 TP5] Found nccl from library libnccl.so.2
[2025-06-23 15:06:59 TP6] Found nccl from library libnccl.so.2
[2025-06-23 15:06:59 TP4] Found nccl from library libnccl.so.2
node-0:270:270 [0] NCCL INFO cudaDriverVersion 12080
node-0:270:270 [0] NCCL INFO NCCL version 2.26.2+cuda12.2
node-0:271:271 [1] NCCL INFO cudaDriverVersion 12080
node-0:271:271 [1] NCCL INFO NCCL_SOCKET_IFNAME set by environment to enx
node-0:271:271 [1] NCCL INFO Bootstrap: Using enxa088c2393978:2a02:6b8:c41:229:0:604:c239:3978<0>
.....
node-0:277:277 [7] NCCL INFO Connected all trees
node-0:276:276 [6] NCCL INFO Connected all trees
node-0:275:275 [5] NCCL INFO Connected all trees
node-0:270:270 [0] NCCL INFO Connected all trees
node-0:273:273 [3] NCCL INFO Connected all trees
node-0:274:274 [4] NCCL INFO Connected all trees
node-0:271:271 [1] NCCL INFO Connected all trees
node-0:272:272 [2] NCCL INFO Connected all trees
node-0:273:273 [3] NCCL INFO threadThresholds 8/8/64 | 128/8/64 | 512 | 512
node-0:273:273 [3] NCCL INFO 28 coll channels, 28 collnet channels, 0 nvls channels, 32 p2p channels, 2 p2p channels per peer
node-0:272:272 [2] NCCL INFO threadThresholds 8/8/64 | 128/8/64 | 512 | 512
node-0:272:272 [2] NCCL INFO 28 coll channels, 28 collnet channels, 0 nvls channels, 32 p2p channels, 2 p2p channels per peer
node-0:270:270 [0] NCCL INFO threadThresholds 8/8/64 | 128/8/64 | 512 | 512
node-0:270:270 [0] NCCL INFO 28 coll channels, 28 collnet channels, 0 nvls channels, 32 p2p channels, 2 p2p channels per peer
node-0:270:270 [0] NCCL INFO CC Off, workFifoBytes 1048576
node-0:276:276 [6] NCCL INFO threadThresholds 8/8/64 | 128/8/64 | 512 | 512
node-0:276:276 [6] NCCL INFO 28 coll channels, 28 collnet channels, 0 nvls channels, 32 p2p channels, 2 p2p channels per peer
node-0:275:275 [5] NCCL INFO threadThresholds 8/8/64 | 128/8/64 | 512 | 512
node-0:275:275 [5] NCCL INFO 28 coll channels, 28 collnet channels, 0 nvls channels, 32 p2p channels, 2 p2p channels per peer
node-0:271:271 [1] NCCL INFO threadThresholds 8/8/64 | 128/8/64 | 512 | 512
node-0:271:271 [1] NCCL INFO 28 coll channels, 28 collnet channels, 0 nvls channels, 32 p2p channels, 2 p2p channels per peer
node-0:274:274 [4] NCCL INFO threadThresholds 8/8/64 | 128/8/64 | 512 | 512
node-0:274:274 [4] NCCL INFO 28 coll channels, 28 collnet channels, 0 nvls channels, 32 p2p channels, 2 p2p channels per peer
node-0:277:2355 [7] NCCL INFO [Proxy Progress] Device 7 CPU core 53
node-0:277:277 [7] NCCL INFO threadThresholds 8/8/64 | 128/8/64 | 512 | 512
node-0:277:277 [7] NCCL INFO 28 coll channels, 28 collnet channels, 0 nvls channels, 32 p2p channels, 2 p2p channels per peer
node-0:270:270 [0] NCCL INFO TUNER/Plugin: Could not find: libnccl-tuner.so. Using internal tuner plugin.
node-0:273:273 [3] NCCL INFO TUNER/Plugin: Could not find: libnccl-tuner.so. Using internal tuner plugin.
node-0:271:271 [1] NCCL INFO TUNER/Plugin: Could not find: libnccl-tuner.so. Using internal tuner plugin.
node-0:270:270 [0] NCCL INFO TUNER/Plugin: Failed to find ncclTunerPlugin_v4 symbol.
node-0:273:273 [3] NCCL INFO TUNER/Plugin: Failed to find ncclTunerPlugin_v4 symbol.
node-0:270:270 [0] NCCL INFO TUNER/Plugin: Failed to find ncclTunerPlugin_v3 symbol.
node-0:271:271 [1] NCCL INFO TUNER/Plugin: Failed to find ncclTunerPlugin_v4 symbol.
node-0:272:272 [2] NCCL INFO TUNER/Plugin: Could not find: libnccl-tuner.so. Using internal tuner plugin.
node-0:273:273 [3] NCCL INFO TUNER/Plugin: Failed to find ncclTunerPlugin_v3 symbol.
node-0:270:270 [0] NCCL INFO TUNER/Plugin: Failed to find ncclTunerPlugin_v2 symbol, using internal tuner instead.
node-0:271:271 [1] NCCL INFO TUNER/Plugin: Failed to find ncclTunerPlugin_v3 symbol.
node-0:273:273 [3] NCCL INFO TUNER/Plugin: Failed to find ncclTunerPlugin_v2 symbol, using internal tuner instead.
node-0:272:272 [2] NCCL INFO TUNER/Plugin: Failed to find ncclTunerPlugin_v4 symbol.
node-0:270:270 [0] NCCL INFO ncclCommInitRank comm 0x109764a0 rank 0 nranks 16 cudaDev 0 nvmlDev 0 busId 18000 commId 0x4ed80120efcb9b9f - Init COMPLETE
node-0:271:271 [1] NCCL INFO TUNER/Plugin: Failed to find ncclTunerPlugin_v2 symbol, using internal tuner instead.
node-0:273:273 [3] NCCL INFO ncclCommInitRank comm 0x247c02b0 rank 3 nranks 16 cudaDev 3 nvmlDev 3 busId 5d000 commId 0x4ed80120efcb9b9f - Init COMPLETE
node-0:276:276 [6] NCCL INFO TUNER/Plugin: Could not find: libnccl-tuner.so. Using internal tuner plugin.
node-0:272:272 [2] NCCL INFO TUNER/Plugin: Failed to find ncclTunerPlugin_v3 symbol.
node-0:275:275 [5] NCCL INFO TUNER/Plugin: Could not find: libnccl-tuner.so. Using internal tuner plugin.
node-0:273:273 [3] NCCL INFO Init timings - ncclCommInitRank: rank 3 nranks 16 total 2.65 (kernels 0.23, alloc 1.00, bootstrap 0.28, allgathers 0.12, topo 0.03, graphs 0.09, connections 0.87, rest 0.01)
node-0:277:277 [7] NCCL INFO TUNER/Plugin: Could not find: libnccl-tuner.so. Using internal tuner plugin.
node-0:274:274 [4] NCCL INFO TUNER/Plugin: Could not find: libnccl-tuner.so. Using internal tuner plugin.
node-0:270:270 [0] NCCL INFO Init timings - ncclCommInitRank: rank 0 nranks 16 total 2.66 (kernels 0.24, alloc 0.96, bootstrap 0.32, allgathers 0.13, topo 0.03, graphs 0.09, connections 0.88, rest 0.01)
node-0:271:271 [1] NCCL INFO ncclCommInitRank comm 0x347e3f40 rank 1 nranks 16 cudaDev 1 nvmlDev 1 busId 2a000 commId 0x4ed80120efcb9b9f - Init COMPLETE
node-0:272:272 [2] NCCL INFO TUNER/Plugin: Failed to find ncclTunerPlugin_v2 symbol, using internal tuner instead.
node-0:276:276 [6] NCCL INFO TUNER/Plugin: Failed to find ncclTunerPlugin_v4 symbol.
node-0:275:275 [5] NCCL INFO TUNER/Plugin: Failed to find ncclTunerPlugin_v4 symbol.
node-0:277:277 [7] NCCL INFO TUNER/Plugin: Failed to find ncclTunerPlugin_v4 symbol.
node-0:274:274 [4] NCCL INFO TUNER/Plugin: Failed to find ncclTunerPlugin_v4 symbol.
node-0:272:272 [2] NCCL INFO ncclCommInitRank comm 0x3fa65e30 rank 2 nranks 16 cudaDev 2 nvmlDev 2 busId 3a000 commId 0x4ed80120efcb9b9f - Init COMPLETE
node-0:276:276 [6] NCCL INFO TUNER/Plugin: Failed to find ncclTunerPlugin_v3 symbol.
node-0:271:271 [1] NCCL INFO Init timings - ncclCommInitRank: rank 1 nranks 16 total 2.65 (kernels 0.23, alloc 1.02, bootstrap 0.27, allgathers 0.12, topo 0.03, graphs 0.09, connections 0.88, rest 0.01)
node-0:275:275 [5] NCCL INFO TUNER/Plugin: Failed to find ncclTunerPlugin_v3 symbol.
node-0:277:277 [7] NCCL INFO TUNER/Plugin: Failed to find ncclTunerPlugin_v3 symbol.
node-0:274:274 [4] NCCL INFO TUNER/Plugin: Failed to find ncclTunerPlugin_v3 symbol.
node-0:275:275 [5] NCCL INFO TUNER/Plugin: Failed to find ncclTunerPlugin_v2 symbol, using internal tuner instead.
node-0:276:276 [6] NCCL INFO TUNER/Plugin: Failed to find ncclTunerPlugin_v2 symbol, using internal tuner instead.
node-0:272:272 [2] NCCL INFO Init timings - ncclCommInitRank: rank 2 nranks 16 total 2.65 (kernels 0.24, alloc 1.00, bootstrap 0.28, allgathers 0.12, topo 0.04, graphs 0.09, connections 0.88, rest 0.01)
node-0:277:277 [7] NCCL INFO TUNER/Plugin: Failed to find ncclTunerPlugin_v2 symbol, using internal tuner instead.
node-0:274:274 [4] NCCL INFO TUNER/Plugin: Failed to find ncclTunerPlugin_v2 symbol, using internal tuner instead.
node-0:275:275 [5] NCCL INFO ncclCommInitRank comm 0x1e577a10 rank 5 nranks 16 cudaDev 5 nvmlDev 5 busId ab000 commId 0x4ed80120efcb9b9f - Init COMPLETE
node-0:276:276 [6] NCCL INFO ncclCommInitRank comm 0x399a1b70 rank 6 nranks 16 cudaDev 6 nvmlDev 6 busId ba000 commId 0x4ed80120efcb9b9f - Init COMPLETE
node-0:277:277 [7] NCCL INFO ncclCommInitRank comm 0x3f92a520 rank 7 nranks 16 cudaDev 7 nvmlDev 7 busId db000 commId 0x4ed80120efcb9b9f - Init COMPLETE
node-0:274:274 [4] NCCL INFO ncclCommInitRank comm 0x20a69610 rank 4 nranks 16 cudaDev 4 nvmlDev 4 busId 9a000 commId 0x4ed80120efcb9b9f - Init COMPLETE
node-0:275:275 [5] NCCL INFO Init timings - ncclCommInitRank: rank 5 nranks 16 total 2.65 (kernels 0.23, alloc 0.87, bootstrap 0.40, allgathers 0.13, topo 0.03, graphs 0.09, connections 0.88, rest 0.01)
node-0:277:277 [7] NCCL INFO Init timings - ncclCommInitRank: rank 7 nranks 16 total 2.65 (kernels 0.23, alloc 1.01, bootstrap 0.27, allgathers 0.13, topo 0.03, graphs 0.09, connections 0.89, rest 0.00)
node-0:276:276 [6] NCCL INFO Init timings - ncclCommInitRank: rank 6 nranks 16 total 2.65 (kernels 0.24, alloc 1.01, bootstrap 0.27, allgathers 0.13, topo 0.03, graphs 0.09, connections 0.88, rest 0.01)
node-0:274:274 [4] NCCL INFO Init timings - ncclCommInitRank: rank 4 nranks 16 total 2.65 (kernels 0.23, alloc 0.97, bootstrap 0.31, allgathers 0.12, topo 0.04, graphs 0.09, connections 0.88, rest 0.01)
[2025-06-23 15:07:01 TP3] Custom allreduce is disabled because this process group spans across nodes.
[2025-06-23 15:07:01 TP2] Custom allreduce is disabled because this process group spans across nodes.
[2025-06-23 15:07:01 TP1] Custom allreduce is disabled because this process group spans across nodes.
[2025-06-23 15:07:01 TP4] Custom allreduce is disabled because this process group spans across nodes.
[2025-06-23 15:07:01 TP0] Custom allreduce is disabled because this process group spans across nodes.
[2025-06-23 15:07:01 TP5] Custom allreduce is disabled because this process group spans across nodes.
[2025-06-23 15:07:01 TP6] Custom allreduce is disabled because this process group spans across nodes.
[2025-06-23 15:07:01 TP7] Custom allreduce is disabled because this process group spans across nodes.
[2025-06-23 15:07:01 TP0] Binding to tcp://127.0.0.1:57063
[2025-06-23 15:07:01 TP0] Message queue communication handle: Handle(connect_ip='[2a02:6b8:c41:229:0:604:c239:3978]', local_reader_ranks=[1, 2, 3, 4, 5, 6, 7], buffer=<sglang.srt.distributed.device_communicators.shm_broadcast.ShmRingBuffer object at 0x7f0a8824a2a0>, local_subscribe_port=57063, remote_subscribe_port=34719)
[2025-06-23 15:07:01 TP4] Connecting to tcp://127.0.0.1:57063
[2025-06-23 15:07:01 TP1] Connecting to tcp://127.0.0.1:57063
[2025-06-23 15:07:01 TP6] Connecting to tcp://127.0.0.1:57063
[2025-06-23 15:07:01 TP3] Connecting to tcp://127.0.0.1:57063
[2025-06-23 15:07:01 TP2] Connecting to tcp://127.0.0.1:57063
[2025-06-23 15:07:01 TP5] Connecting to tcp://127.0.0.1:57063
[2025-06-23 15:07:01 TP7] Connecting to tcp://127.0.0.1:57063
``` 

Node1:
```
+ python3 -m sglang.launch_server --model /place/deepseek-r1/weights --served-model-name deepseek-r1 --chunked-prefill-size 4096 --context-length 32768 --skip-tokenizer-init --enable-mixed-chunk --disable-radix-cache --tp 16 --dist-init-addr node-0.company.net:20000 --nnodes 2 --node-rank 1 --trust-remote-code --host :: --port 40000 --log-level=debug
[2025-06-23 15:06:53] Setting Triton cache manager to: sglang.srt.utils:CustomCacheManager
[2025-06-23 15:06:53] server_args=ServerArgs(model_path='/place/deepseek-r1/weights', tokenizer_path='/place/deepseek-r1/weights', tokenizer_mode='auto', skip_tokenizer_init=True, load_format='auto', trust_remote_code=True, dtype='auto', kv_cache_dtype='auto', quantization=None, quantization_param_path=None, context_length=32768, device='cuda', served_model_name='deepseek-r1', chat_template=None, completion_template=None, is_embedding=False, enable_multimodal=None, revision=None, impl='auto', host='::', port=40000, mem_fraction_static=0.78, max_running_requests=None, max_total_tokens=None, chunked_prefill_size=4096, max_prefill_tokens=16384, schedule_policy='fcfs', schedule_conservativeness=1.0, cpu_offload_gb=0, page_size=1, tp_size=16, pp_size=1, max_micro_batch_size=None, stream_interval=1, stream_output=False, random_seed=473803189, constrained_json_whitespace_pattern=None, watchdog_timeout=300, dist_timeout=None, download_dir=None, base_gpu_id=0, gpu_id_step=1, sleep_on_idle=False, log_level='debug', log_level_http=None, log_requests=False, log_requests_level=0, show_time_cost=False, enable_metrics=False, bucket_time_to_first_token=None, bucket_e2e_request_latency=None, bucket_inter_token_latency=None, collect_tokens_histogram=False, decode_log_interval=40, enable_request_time_stats_logging=False, kv_events_config=None, api_key=None, file_storage_path='sglang_storage', enable_cache_report=False, reasoning_parser=None, tool_call_parser=None, dp_size=1, load_balance_method='round_robin', dist_init_addr='node-0.company.net:20000', nnodes=2, node_rank=1, json_model_override_args='{}', preferred_sampling_params=None, lora_paths=None, max_loras_per_batch=8, lora_backend='triton', attention_backend=None, sampling_backend='flashinfer', grammar_backend='xgrammar', mm_attention_backend=None, speculative_algorithm=None, speculative_draft_model_path=None, speculative_num_steps=None, speculative_eagle_topk=None, speculative_num_draft_tokens=None, speculative_accept_threshold_single=1.0, speculative_accept_threshold_acc=1.0, speculative_token_map=None, ep_size=1, enable_ep_moe=False, enable_deepep_moe=False, deepep_mode='auto', ep_num_redundant_experts=0, ep_dispatch_algorithm='static', init_expert_location='trivial', enable_eplb=False, eplb_algorithm='auto', eplb_rebalance_num_iterations=1000, eplb_rebalance_layers_per_chunk=None, expert_distribution_recorder_mode=None, expert_distribution_recorder_buffer_size=1000, enable_expert_distribution_metrics=False, deepep_config=None, moe_dense_tp_size=None, enable_double_sparsity=False, ds_channel_config_path=None, ds_heavy_channel_num=32, ds_heavy_token_num=256, ds_heavy_channel_type='qk', ds_sparse_decode_threshold=4096, disable_radix_cache=True, cuda_graph_max_bs=None, cuda_graph_bs=None, disable_cuda_graph=False, disable_cuda_graph_padding=False, enable_profile_cuda_graph=False, enable_nccl_nvls=False, enable_tokenizer_batch_encode=False, disable_outlines_disk_cache=False, disable_custom_all_reduce=False, enable_mscclpp=False, disable_overlap_schedule=False, disable_overlap_cg_plan=False, enable_mixed_chunk=True, enable_dp_attention=False, enable_dp_lm_head=False, enable_two_batch_overlap=False, enable_torch_compile=False, torch_compile_max_bs=32, torchao_config='', enable_nan_detection=False, enable_p2p_check=False, triton_attention_reduce_in_fp32=False, triton_attention_num_kv_splits=8, num_continuous_decode_steps=1, delete_ckpt_after_loading=False, enable_memory_saver=False, allow_auto_truncate=False, enable_custom_logit_processor=False, enable_hierarchical_cache=False, hicache_ratio=2.0, hicache_size=0, hicache_write_policy='write_through_selective', flashinfer_mla_disable_ragged=False, disable_shared_experts_fusion=False, disable_chunked_prefix_cache=False, disable_fast_image_processor=False, enable_return_hidden_states=False, warmups=None, debug_tensor_dump_output_folder=None, debug_tensor_dump_input_file=None, debug_tensor_dump_inject=False, debug_tensor_dump_prefill_only=False, disaggregation_mode='null', disaggregation_transfer_backend='mooncake', disaggregation_bootstrap_port=8998, disaggregation_decode_tp=None, disaggregation_decode_dp=None, disaggregation_prefill_pp=1, disaggregation_ib_device=None, num_reserved_decode_tokens=512, pdlb_url=None)
[2025-06-23 15:06:58 TP9] world_size=16 rank=9 local_rank=1 distributed_init_method=tcp://node-0.company.net:20000 backend=nccl
[2025-06-23 15:06:58 TP12] world_size=16 rank=12 local_rank=4 distributed_init_method=tcp://node-0.company.net:20000 backend=nccl
[2025-06-23 15:06:59 TP14] world_size=16 rank=14 local_rank=6 distributed_init_method=tcp://node-0.company.net:20000 backend=nccl
[2025-06-23 15:06:59 TP8] world_size=16 rank=8 local_rank=0 distributed_init_method=tcp://node-0.company.net:20000 backend=nccl
[2025-06-23 15:06:59 TP15] world_size=16 rank=15 local_rank=7 distributed_init_method=tcp://node-0.company.net:20000 backend=nccl
[2025-06-23 15:06:59 TP13] world_size=16 rank=13 local_rank=5 distributed_init_method=tcp://node-0.company.net:20000 backend=nccl
[2025-06-23 15:06:59 TP11] world_size=16 rank=11 local_rank=3 distributed_init_method=tcp://node-0.company.net:20000 backend=nccl
[2025-06-23 15:06:59 TP10] world_size=16 rank=10 local_rank=2 distributed_init_method=tcp://node-0.company.net:20000 backend=nccl
[2025-06-23 15:06:59 TP8] Found nccl from library libnccl.so.2
[2025-06-23 15:06:59 TP9] Found nccl from library libnccl.so.2
[2025-06-23 15:06:59 TP11] Found nccl from library libnccl.so.2
[2025-06-23 15:06:59 TP10] Found nccl from library libnccl.so.2
[2025-06-23 15:06:59 TP13] Found nccl from library libnccl.so.2
[2025-06-23 15:06:59 TP15] Found nccl from library libnccl.so.2
[2025-06-23 15:06:59 TP12] Found nccl from library libnccl.so.2
[2025-06-23 15:06:59 TP14] Found nccl from library libnccl.so.2
node-1:271:271 [0] NCCL INFO cudaDriverVersion 12080
node-1:271:271 [0] NCCL INFO NCCL_SOCKET_IFNAME set by environment to enx
node-1:271:271 [0] NCCL INFO Bootstrap: Using enx58a2e148fea0:2a02:6b8:c41:183:0:604:e148:fea0<0>
node-1:271:271 [0] NCCL INFO NCCL version 2.26.2+cuda12.2
node-1:275:275 [4] NCCL INFO cudaDriverVersion 12080
...
node-1:277:277 [6] NCCL INFO Connected all trees
node-1:278:278 [7] NCCL INFO Connected all trees
node-1:276:276 [5] NCCL INFO Connected all trees
node-1:271:271 [0] NCCL INFO Connected all trees
node-1:272:272 [1] NCCL INFO Connected all trees
node-1:273:273 [2] NCCL INFO Connected all trees
node-1:274:274 [3] NCCL INFO Connected all trees
node-1:275:275 [4] NCCL INFO Connected all trees
node-1:271:271 [0] NCCL INFO threadThresholds 8/8/64 | 128/8/64 | 512 | 512
node-1:271:271 [0] NCCL INFO 28 coll channels, 28 collnet channels, 0 nvls channels, 32 p2p channels, 2 p2p channels per peer
node-1:277:277 [6] NCCL INFO threadThresholds 8/8/64 | 128/8/64 | 512 | 512
node-1:277:277 [6] NCCL INFO 28 coll channels, 28 collnet channels, 0 nvls channels, 32 p2p channels, 2 p2p channels per peer
node-1:273:273 [2] NCCL INFO threadThresholds 8/8/64 | 128/8/64 | 512 | 512
node-1:273:273 [2] NCCL INFO 28 coll channels, 28 collnet channels, 0 nvls channels, 32 p2p channels, 2 p2p channels per peer
node-1:272:272 [1] NCCL INFO threadThresholds 8/8/64 | 128/8/64 | 512 | 512
node-1:278:278 [7] NCCL INFO threadThresholds 8/8/64 | 128/8/64 | 512 | 512
node-1:272:272 [1] NCCL INFO 28 coll channels, 28 collnet channels, 0 nvls channels, 32 p2p channels, 2 p2p channels per peer
node-1:278:278 [7] NCCL INFO 28 coll channels, 28 collnet channels, 0 nvls channels, 32 p2p channels, 2 p2p channels per peer
node-1:274:274 [3] NCCL INFO threadThresholds 8/8/64 | 128/8/64 | 512 | 512
node-1:274:274 [3] NCCL INFO 28 coll channels, 28 collnet channels, 0 nvls channels, 32 p2p channels, 2 p2p channels per peer
node-1:275:275 [4] NCCL INFO threadThresholds 8/8/64 | 128/8/64 | 512 | 512
node-1:275:275 [4] NCCL INFO 28 coll channels, 28 collnet channels, 0 nvls channels, 32 p2p channels, 2 p2p channels per peer
node-1:276:1768 [5] NCCL INFO [Proxy Progress] Device 5 CPU core 207
node-1:276:276 [5] NCCL INFO threadThresholds 8/8/64 | 128/8/64 | 512 | 512
node-1:276:276 [5] NCCL INFO 28 coll channels, 28 collnet channels, 0 nvls channels, 32 p2p channels, 2 p2p channels per peer
node-1:276:276 [5] NCCL INFO TUNER/Plugin: Could not find: libnccl-tuner.so. Using internal tuner plugin.
node-1:274:274 [3] NCCL INFO TUNER/Plugin: Could not find: libnccl-tuner.so. Using internal tuner plugin.
node-1:272:272 [1] NCCL INFO TUNER/Plugin: Could not find: libnccl-tuner.so. Using internal tuner plugin.
node-1:276:276 [5] NCCL INFO TUNER/Plugin: Failed to find ncclTunerPlugin_v4 symbol.
node-1:274:274 [3] NCCL INFO TUNER/Plugin: Failed to find ncclTunerPlugin_v4 symbol.
node-1:275:275 [4] NCCL INFO TUNER/Plugin: Could not find: libnccl-tuner.so. Using internal tuner plugin.
node-1:277:277 [6] NCCL INFO TUNER/Plugin: Could not find: libnccl-tuner.so. Using internal tuner plugin.
node-1:273:273 [2] NCCL INFO TUNER/Plugin: Could not find: libnccl-tuner.so. Using internal tuner plugin.
node-1:271:271 [0] NCCL INFO TUNER/Plugin: Could not find: libnccl-tuner.so. Using internal tuner plugin.
node-1:272:272 [1] NCCL INFO TUNER/Plugin: Failed to find ncclTunerPlugin_v4 symbol.
node-1:276:276 [5] NCCL INFO TUNER/Plugin: Failed to find ncclTunerPlugin_v3 symbol.
node-1:274:274 [3] NCCL INFO TUNER/Plugin: Failed to find ncclTunerPlugin_v3 symbol.
node-1:278:278 [7] NCCL INFO TUNER/Plugin: Could not find: libnccl-tuner.so. Using internal tuner plugin.
node-1:275:275 [4] NCCL INFO TUNER/Plugin: Failed to find ncclTunerPlugin_v4 symbol.
node-1:277:277 [6] NCCL INFO TUNER/Plugin: Failed to find ncclTunerPlugin_v4 symbol.
node-1:273:273 [2] NCCL INFO TUNER/Plugin: Failed to find ncclTunerPlugin_v4 symbol.
node-1:272:272 [1] NCCL INFO TUNER/Plugin: Failed to find ncclTunerPlugin_v3 symbol.
node-1:271:271 [0] NCCL INFO TUNER/Plugin: Failed to find ncclTunerPlugin_v4 symbol.
node-1:276:276 [5] NCCL INFO TUNER/Plugin: Failed to find ncclTunerPlugin_v2 symbol, using internal tuner instead.
node-1:274:274 [3] NCCL INFO TUNER/Plugin: Failed to find ncclTunerPlugin_v2 symbol, using internal tuner instead.
node-1:275:275 [4] NCCL INFO TUNER/Plugin: Failed to find ncclTunerPlugin_v3 symbol.
node-1:277:277 [6] NCCL INFO TUNER/Plugin: Failed to find ncclTunerPlugin_v3 symbol.
node-1:275:275 [4] NCCL INFO TUNER/Plugin: Failed to find ncclTunerPlugin_v2 symbol, using internal tuner instead.
node-1:278:278 [7] NCCL INFO TUNER/Plugin: Failed to find ncclTunerPlugin_v4 symbol.
node-1:273:273 [2] NCCL INFO TUNER/Plugin: Failed to find ncclTunerPlugin_v3 symbol.
node-1:272:272 [1] NCCL INFO TUNER/Plugin: Failed to find ncclTunerPlugin_v2 symbol, using internal tuner instead.
node-1:271:271 [0] NCCL INFO TUNER/Plugin: Failed to find ncclTunerPlugin_v3 symbol.
node-1:276:276 [5] NCCL INFO ncclCommInitRank comm 0x369e2a10 rank 13 nranks 16 cudaDev 5 nvmlDev 5 busId ae000 commId 0x4ed80120efcb9b9f - Init COMPLETE
node-1:274:274 [3] NCCL INFO ncclCommInitRank comm 0x2f8275b0 rank 11 nranks 16 cudaDev 3 nvmlDev 3 busId 5a000 commId 0x4ed80120efcb9b9f - Init COMPLETE
node-1:277:277 [6] NCCL INFO TUNER/Plugin: Failed to find ncclTunerPlugin_v2 symbol, using internal tuner instead.
node-1:275:275 [4] NCCL INFO ncclCommInitRank comm 0x14895970 rank 12 nranks 16 cudaDev 4 nvmlDev 4 busId 87000 commId 0x4ed80120efcb9b9f - Init COMPLETE
node-1:278:278 [7] NCCL INFO TUNER/Plugin: Failed to find ncclTunerPlugin_v3 symbol.
node-1:277:277 [6] NCCL INFO ncclCommInitRank comm 0x46c80a00 rank 14 nranks 16 cudaDev 6 nvmlDev 6 busId c2000 commId 0x4ed80120efcb9b9f - Init COMPLETE
node-1:273:273 [2] NCCL INFO TUNER/Plugin: Failed to find ncclTunerPlugin_v2 symbol, using internal tuner instead.
node-1:272:272 [1] NCCL INFO ncclCommInitRank comm 0x3ef48660 rank 9 nranks 16 cudaDev 1 nvmlDev 1 busId 34000 commId 0x4ed80120efcb9b9f - Init COMPLETE
node-1:271:271 [0] NCCL INFO TUNER/Plugin: Failed to find ncclTunerPlugin_v2 symbol, using internal tuner instead.
node-1:276:276 [5] NCCL INFO Init timings - ncclCommInitRank: rank 13 nranks 16 total 2.65 (kernels 0.25, alloc 1.23, bootstrap 0.03, allgathers 0.06, topo 0.09, graphs 0.10, connections 0.89, rest 0.00)
node-1:274:274 [3] NCCL INFO Init timings - ncclCommInitRank: rank 11 nranks 16 total 2.65 (kernels 0.25, alloc 1.24, bootstrap 0.02, allgathers 0.00, topo 0.09, graphs 0.15, connections 0.87, rest 0.02)
node-1:278:278 [7] NCCL INFO TUNER/Plugin: Failed to find ncclTunerPlugin_v2 symbol, using internal tuner instead.
node-1:275:275 [4] NCCL INFO Init timings - ncclCommInitRank: rank 12 nranks 16 total 2.65 (kernels 0.33, alloc 1.18, bootstrap 0.00, allgathers 0.05, topo 0.09, graphs 0.10, connections 0.87, rest 0.02)
node-1:277:277 [6] NCCL INFO Init timings - ncclCommInitRank: rank 14 nranks 16 total 2.65 (kernels 0.33, alloc 1.18, bootstrap 0.00, allgathers 0.06, topo 0.09, graphs 0.10, connections 0.87, rest 0.02)
node-1:273:273 [2] NCCL INFO ncclCommInitRank comm 0x2e748650 rank 10 nranks 16 cudaDev 2 nvmlDev 2 busId 48000 commId 0x4ed80120efcb9b9f - Init COMPLETE
node-1:271:271 [0] NCCL INFO ncclCommInitRank comm 0x2fd4d040 rank 8 nranks 16 cudaDev 0 nvmlDev 0 busId f000 commId 0x4ed80120efcb9b9f - Init COMPLETE
node-1:272:272 [1] NCCL INFO Init timings - ncclCommInitRank: rank 9 nranks 16 total 2.65 (kernels 0.25, alloc 1.23, bootstrap 0.03, allgathers 0.06, topo 0.10, graphs 0.09, connections 0.87, rest 0.02)
node-1:278:278 [7] NCCL INFO ncclCommInitRank comm 0x19b24810 rank 15 nranks 16 cudaDev 7 nvmlDev 7 busId d7000 commId 0x4ed80120efcb9b9f - Init COMPLETE
node-1:273:273 [2] NCCL INFO Init timings - ncclCommInitRank: rank 10 nranks 16 total 2.65 (kernels 0.24, alloc 1.21, bootstrap 0.05, allgathers 0.06, topo 0.10, graphs 0.09, connections 0.87, rest 0.02)
node-1:271:271 [0] NCCL INFO Init timings - ncclCommInitRank: rank 8 nranks 16 total 2.65 (kernels 0.25, alloc 1.18, bootstrap 0.09, allgathers 0.00, topo 0.09, graphs 0.15, connections 0.87, rest 0.02)
node-1:278:278 [7] NCCL INFO Init timings - ncclCommInitRank: rank 15 nranks 16 total 2.65 (kernels 0.25, alloc 1.23, bootstrap 0.03, allgathers 0.06, topo 0.09, graphs 0.10, connections 0.87, rest 0.02)
[2025-06-23 15:07:01 TP15] Custom allreduce is disabled because this process group spans across nodes.
[2025-06-23 15:07:01 TP14] Custom allreduce is disabled because this process group spans across nodes.
[2025-06-23 15:07:01 TP13] Custom allreduce is disabled because this process group spans across nodes.
[2025-06-23 15:07:01 TP12] Custom allreduce is disabled because this process group spans across nodes.
[2025-06-23 15:07:01 TP11] Custom allreduce is disabled because this process group spans across nodes.
[2025-06-23 15:07:01 TP10] Custom allreduce is disabled because this process group spans across nodes.
[2025-06-23 15:07:01 TP9] Custom allreduce is disabled because this process group spans across nodes.
[2025-06-23 15:07:01 TP8] Custom allreduce is disabled because this process group spans across nodes.
[2025-06-23 15:07:01 TP10] Connecting to tcp://[2a02:6b8:c41:229:0:604:c239:3978]:34719
[2025-06-23 15:07:01 TP9] Connecting to tcp://[2a02:6b8:c41:229:0:604:c239:3978]:34719
[2025-06-23 15:07:01 TP8] Connecting to tcp://[2a02:6b8:c41:229:0:604:c239:3978]:34719
[2025-06-23 15:07:01 TP12] Connecting to tcp://[2a02:6b8:c41:229:0:604:c239:3978]:34719
[2025-06-23 15:07:01 TP11] Connecting to tcp://[2a02:6b8:c41:229:0:604:c239:3978]:34719
[2025-06-23 15:07:01 TP13] Connecting to tcp://[2a02:6b8:c41:229:0:604:c239:3978]:34719
[2025-06-23 15:07:01 TP14] Connecting to tcp://[2a02:6b8:c41:229:0:604:c239:3978]:34719
[2025-06-23 15:07:01 TP15] Connecting to tcp://[2a02:6b8:c41:229:0:604:c239:3978]:34719
```

Also, tcpdump on both nodes show transfer between two nodes. 
```
18:15:14.277648 enxa088c2393978 Out IP6 node-0.company.net.20000 > node-1.company.net.34694: Flags [P.], seq 10017:10018, ack 20235, win 137, options [nop,nop,TS val 1168674605 ecr 2076068050], length 1
18:15:14.277807 enxa088c2393978 In  IP6 node-1.company.net.34650 > node-0.company.net.20000: Flags [P.], seq 20203:20235, ack 10017, win 137, options [nop,nop,TS val 2076068051 ecr 1168673605], length 32
18:15:14.277825 enxa088c2393978 Out IP6 node-0.company.net.20000 > node-1.company.net.34650: Flags [P.], seq 10017:10018, ack 20235, win 137, options [nop,nop,TS val 1168674605 ecr 2076068051], length 1
18:15:14.277826 enxa088c2393978 In  IP6 node-1.company.net.34694 > node-0.company.net.20000: Flags [.], ack 10018, win 137, options [nop,nop,TS val 2076068051 ecr 1168674605], length 0
18:15:14.278203 enxa088c2393978 In  IP6 node-1.company.net.34650 > node-0.company.net.20000: Flags [.], ack 10018, win 137, options [nop,nop,TS val 2076068051 ecr 1168674605], length 0
18:15:14.289918 enxa088c2393978 In  IP6 node-1.company.net.34676 > node-0.company.net.20000: Flags [P.], seq 20203:20235, ack 10017, win 137, options [nop,nop,TS val 2076068063 ecr 1168673617], length 32
18:15:14.290059 enxa088c2393978 Out IP6 node-0.company.net.20000 > node-1.company.net.34676: Flags [P.], seq 10017:10018, ack 20235, win 137, options [nop,nop,TS val 1168674617 ecr 2076068063], length 1
18:15:14.290334 enxa088c2393978 In  IP6 node-1.company.net.34676 > node-0.company.net.20000: Flags [.], ack 10018, win 137, options [nop,nop,TS val 2076068063 ecr 1168674617], length 0
18:15:14.293158 enxa088c2393978 In  IP6 node-1.company.net.34688 > node-0.company.net.20000: Flags [P.], seq 20203:20235, ack 10017, win 137, options [nop,nop,TS val 2076068066 ecr 1168673620], length 32
18:15:14.293176 enxa088c2393978 Out IP6 node-0.company.net.20000 > node-1.company.net.34688: Flags [P.], seq 10017:10018, ack 20235, win 137, options [nop,nop,TS val 1168674621 ecr 2076068066], length 1
18:15:14.293228 enxa088c2393978 In  IP6 node-1.company.net.34652 > node-0.company.net.20000: Flags [P.], seq 20203:20235, ack 10017, win 137, options [nop,nop,TS val 2076068066 ecr 1168673620], length 32
18:15:14.293243 enxa088c2393978 Out IP6 node-0.company.net.20000 > node-1.company.net.34652: Flags [P.], seq 10017:10018, ack 20235, win 137, options [nop,nop,TS val 1168674621 ecr 2076068066], length 1
18:15:14.293371 enxa088c2393978 In  IP6 node-1.company.net.34688 > node-0.company.net.20000: Flags [.], ack 10018, win 137, options [nop,nop,TS val 2076068066 ecr 1168674621], length 0
18:15:14.293408 enxa088c2393978 In  IP6 node-1.company.net.34652 > node-0.company.net.20000: Flags [.], ack 10018, win 137, options [nop,nop,TS val 2076068066 ecr 1168674621], length 0
18:15:14.300604 enxa088c2393978 In  IP6 node-1.company.net.34666 > node-0.company.net.20000: Flags [P.], seq 20207:20239, ack 10017, win 137, options [nop,nop,TS val 2076068074 ecr 1168673627], length 32
18:15:14.300619 enxa088c2393978 Out IP6 node-0.company.net.20000 > node-1.company.net.34666: Flags [P.], seq 10017:10018, ack 20239, win 137, options [nop,nop,TS val 1168674628 ecr 2076068074], length 1
18:15:14.301089 enxa088c2393978 In  IP6 node-1.company.net.34666 > node-0.company.net.20000: Flags [.], ack 10018, win 137, options [nop,nop,TS val 2076068074 ecr 1168674628], length 0
18:15:14.343075 enxa088c2393978 In  IP6 node-1.company.net.34702 > node-0.company.net.20000: Flags [P.], seq 20203:20235, ack 10017, win 137, options [nop,nop,TS val 2076068116 ecr 1168673670], length 32
18:15:14.343128 enxa088c2393978 Out IP6 node-0.company.net.20000 > node-1.company.net.34702: Flags [P.], seq 10017:10018, ack 20235, win 137, options [nop,nop,TS val 1168674671 ecr 2076068116], length 1
18:15:14.343347 enxa088c2393978 In  IP6 node-1.company.net.34702 > node-0.company.net.20000: Flags [.], ack 10018, win 137, options [nop,nop,TS val 2076068116 ecr 1168674671], length 0
18:15:14.573760 enxa088c2393978 In  IP6 node-1.company.net.34644 > node-0.company.net.20000: Flags [P.], seq 20239:20271, ack 10018, win 137, options [nop,nop,TS val 2076068347 ecr 1168673900], length 32
18:15:14.573904 enxa088c2393978 Out IP6 node-0.company.net.20000 > node-1.company.net.34644: Flags [P.], seq 10018:10019, ack 20271, win 137, options [nop,nop,TS val 1168674901 ecr 2076068347], length 1

```

From my logs I can observe, that NCCL connection established. But, it not going to load weights. 

After 1800 seconds, it exits with the timeout.

```
[rank1]:[W623 15:37:01.823833318 socket.cpp:460] [c10d] waitForInput: poll for socket SocketImpl(fd=100, addr=[node-0.company.net]:43590, remote=[node-0.company.net]:20000) returned 0, likely a timeout
[rank1]:[W623 15:37:01.824135523 socket.cpp:485] [c10d] waitForInput: socket SocketImpl(fd=100, addr=[node-0.company.net]:43590, remote=[node-0.company.net]:20000) timed out after 1800000ms
[rank7]:[W623 15:37:01.834946117 socket.cpp:460] [c10d] waitForInput: poll for socket SocketImpl(fd=100, addr=[node-0.company.net]:43570, remote=[node-0.company.net]:20000) returned 0, likely a timeout
[rank7]:[W623 15:37:01.835386612 socket.cpp:485] [c10d] waitForInput: socket SocketImpl(fd=100, addr=[node-0.company.net]:43570, remote=[node-0.company.net]:20000) timed out after 1800000ms
[2025-06-23 15:37:01 TP1] Scheduler hit an exception: Traceback (most recent call last):
  File "/sgl-workspace/sglang/python/sglang/srt/managers/scheduler.py", line 2546, in run_scheduler_process
    scheduler = Scheduler(server_args, port_args, gpu_id, tp_rank, pp_rank, dp_rank)
                ^^^^^^^^^^^^^^^^^^^^^^^^^^^^^^^^^^^^^^^^^^^^^^^^^^^^^^^^^^^^^^^^^^^^
  File "/sgl-workspace/sglang/python/sglang/srt/managers/scheduler.py", line 312, in __init__
    self.tp_worker = TpWorkerClass(
                     ^^^^^^^^^^^^^^
  File "/sgl-workspace/sglang/python/sglang/srt/managers/tp_worker_overlap_thread.py", line 64, in __init__
    self.worker = TpModelWorker(
                  ^^^^^^^^^^^^^^
  File "/sgl-workspace/sglang/python/sglang/srt/managers/tp_worker.py", line 78, in __init__
    self.model_runner = ModelRunner(
                        ^^^^^^^^^^^^
  File "/sgl-workspace/sglang/python/sglang/srt/model_executor/model_runner.py", line 205, in __init__
    min_per_gpu_memory = self.init_torch_distributed()
                         ^^^^^^^^^^^^^^^^^^^^^^^^^^^^^
  File "/sgl-workspace/sglang/python/sglang/srt/model_executor/model_runner.py", line 474, in init_torch_distributed
    initialize_dp_attention(
  File "/sgl-workspace/sglang/python/sglang/srt/layers/dp_attention.py", line 94, in initialize_dp_attention
    _ATTN_TP_GROUP = GroupCoordinator(
                     ^^^^^^^^^^^^^^^^^
  File "/sgl-workspace/sglang/python/sglang/srt/distributed/parallel_state.py", line 232, in __init__
    cpu_group = torch.distributed.new_group(ranks, backend="gloo")
                ^^^^^^^^^^^^^^^^^^^^^^^^^^^^^^^^^^^^^^^^^^^^^^^^^^
  File "/usr/local/lib/python3.12/dist-packages/torch/distributed/c10d_logger.py", line 95, in wrapper
    func_return = func(*args, **kwargs)
                  ^^^^^^^^^^^^^^^^^^^^^
  File "/usr/local/lib/python3.12/dist-packages/torch/distributed/distributed_c10d.py", line 5065, in new_group
    return _new_group_with_tag(
           ^^^^^^^^^^^^^^^^^^^^
  File "/usr/local/lib/python3.12/dist-packages/torch/distributed/distributed_c10d.py", line 5155, in _new_group_with_tag
    pg, pg_store = _new_process_group_helper(
                   ^^^^^^^^^^^^^^^^^^^^^^^^^^
  File "/usr/local/lib/python3.12/dist-packages/torch/distributed/distributed_c10d.py", line 1942, in _new_process_group_helper
    backend_class = ProcessGroupGloo(
                    ^^^^^^^^^^^^^^^^^
torch.distributed.DistStoreError: wait timeout after 1800000ms, keys: /default_pg/0//38//cpu//0/0

[2025-06-23 15:37:01] Received sigquit from a child process. It usually means the child failed.
[2025-06-23 15:37:01 TP7] Scheduler hit an exception: Traceback (most recent call last):
  File "/sgl-workspace/sglang/python/sglang/srt/managers/scheduler.py", line 2546, in run_scheduler_process
    scheduler = Scheduler(server_args, port_args, gpu_id, tp_rank, pp_rank, dp_rank)
                ^^^^^^^^^^^^^^^^^^^^^^^^^^^^^^^^^^^^^^^^^^^^^^^^^^^^^^^^^^^^^^^^^^^^
  File "/sgl-workspace/sglang/python/sglang/srt/managers/scheduler.py", line 312, in __init__
    self.tp_worker = TpWorkerClass(
                     ^^^^^^^^^^^^^^
  File "/sgl-workspace/sglang/python/sglang/srt/managers/tp_worker_overlap_thread.py", line 64, in __init__
    self.worker = TpModelWorker(
                  ^^^^^^^^^^^^^^
  File "/sgl-workspace/sglang/python/sglang/srt/managers/tp_worker.py", line 78, in __init__
    self.model_runner = ModelRunner(
                        ^^^^^^^^^^^^
  File "/sgl-workspace/sglang/python/sglang/srt/model_executor/model_runner.py", line 205, in __init__
    min_per_gpu_memory = self.init_torch_distributed()
                         ^^^^^^^^^^^^^^^^^^^^^^^^^^^^^
  File "/sgl-workspace/sglang/python/sglang/srt/model_executor/model_runner.py", line 474, in init_torch_distributed
    initialize_dp_attention(
  File "/sgl-workspace/sglang/python/sglang/srt/layers/dp_attention.py", line 94, in initialize_dp_attention
    _ATTN_TP_GROUP = GroupCoordinator(
                     ^^^^^^^^^^^^^^^^^
  File "/sgl-workspace/sglang/python/sglang/srt/distributed/parallel_state.py", line 232, in __init__
    cpu_group = torch.distributed.new_group(ranks, backend="gloo")
                ^^^^^^^^^^^^^^^^^^^^^^^^^^^^^^^^^^^^^^^^^^^^^^^^^^
  File "/usr/local/lib/python3.12/dist-packages/torch/distributed/c10d_logger.py", line 95, in wrapper
    func_return = func(*args, **kwargs)
                  ^^^^^^^^^^^^^^^^^^^^^
  File "/usr/local/lib/python3.12/dist-packages/torch/distributed/distributed_c10d.py", line 5065, in new_group
    return _new_group_with_tag(
           ^^^^^^^^^^^^^^^^^^^^
  File "/usr/local/lib/python3.12/dist-packages/torch/distributed/distributed_c10d.py", line 5155, in _new_group_with_tag
    pg, pg_store = _new_process_group_helper(
                   ^^^^^^^^^^^^^^^^^^^^^^^^^^
  File "/usr/local/lib/python3.12/dist-packages/torch/distributed/distributed_c10d.py", line 1942, in _new_process_group_helper
    backend_class = ProcessGroupGloo(
                    ^^^^^^^^^^^^^^^^^
torch.distributed.DistStoreError: wait timeout after 1800000ms, keys: /default_pg/0//38//cpu//0/0

[2025-06-23 15:37:01] Received sigquit from a child process. It usually means the child failed.
```

### Reproduction

Node0: 
```
docker run --gpus all \
    --shm-size 512g \
    --network=host \
    -v /place/deepseek-r1:/place/deepseek-r1 \
    --name sglang_multinode_worker0 \
    -it \
    --rm \
    --ipc=host \
    --privileged \
    lmsysorg/sglang:v0.4.7.post1-cu124 \
    	bash -c "
	set -xeou
	export GLOO_SOCKET_IFNAME=enxa088c2393978
	export NCCL_SOCKET_IFNAME=enx
	export NCCL_NVLS_ENABLE=0
	export SGLANG_HOST_IP=`hostname -i`
	export GLOO_LOG_LEVEL=DEBUG
	export NCCL_DEBUG=TRACE
	python3 -m sglang.launch_server \
		--model /place/deepseek-r1/weights \
		--served-model-name deepseek-r1 \
		--chunked-prefill-size 4096 \
		--context-length 32768 --skip-tokenizer-init --enable-mixed-chunk  \
		--disable-radix-cache \
		--tp 16 --dist-init-addr node-0.company.net:20000 \
		--nnodes 2 --node-rank 0 \
		--trust-remote-code --host :: --port 40000 \
	        --log-level=debug
        "
```

Node1:
```
docker run --gpus all \
    --shm-size 512g \
    --network=host \
    -v /place/deepseek-r1:/place/deepseek-r1 \
    --name sglang_multinode_worker1 \
    -it \
    --rm \
    --ipc=host \
    --privileged \
    lmsysorg/sglang:v0.4.7.post1-cu124 \
    	bash -c "
	set -xeou
	export GLOO_SOCKET_IFNAME=enx58a2e148fea0
	export NCCL_SOCKET_IFNAME=enx
	export NCCL_NVLS_ENABLE=0
	export SGLANG_HOST_IP=`hostname -i`
	export GLOO_LOG_LEVEL=DEBUG
	export NCCL_DEBUG=TRACE
        python3 -m sglang.launch_server \
                --model /place/deepseek-r1/weights \
                --served-model-name deepseek-r1 \
                --chunked-prefill-size 4096 \
                --context-length 32768 --skip-tokenizer-init --enable-mixed-chunk  \
                --disable-radix-cache \
                --tp 16 --dist-init-addr node-0.company.net:20000 \
                --nnodes 2 --node-rank 1 \
                --trust-remote-code --host :: --port 40000 \
                --log-level=debug    
        "

```

### Node0

**Docker info**
```
Client: Docker Engine - Community
 Version:    28.2.2
 Context:    default
 Debug Mode: false
 Plugins:
  buildx: Docker Buildx (Docker Inc.)
    Version:  v0.24.0
    Path:     /usr/libexec/docker/cli-plugins/docker-buildx
  compose: Docker Compose (Docker Inc.)
    Version:  v2.36.2
    Path:     /usr/libexec/docker/cli-plugins/docker-compose

Server:
 Containers: 3
  Running: 0
  Paused: 0
  Stopped: 3
 Images: 3
 Server Version: 28.2.2
 Storage Driver: overlay2
  Backing Filesystem: extfs
  Supports d_type: true
  Using metacopy: false
  Native Overlay Diff: true
  userxattr: false
 Logging Driver: json-file
 Cgroup Driver: cgroupfs
 Cgroup Version: 1
 Plugins:
  Volume: local
  Network: bridge host ipvlan macvlan null overlay
  Log: awslogs fluentd gcplogs gelf journald json-file local splunk syslog
 CDI spec directories:
  /etc/cdi
  /var/run/cdi
 Swarm: inactive
 Runtimes: io.containerd.runc.v2 nvidia runc
 Default Runtime: nvidia
 Init Binary: docker-init
 containerd version: 05044ec0a9a75232cad458027ca83437aae3f4da
 runc version: v1.2.5-0-g59923ef
 init version: de40ad0
 Security Options:
  seccomp
   Profile: builtin
 Kernel Version: 5.15.179-15
 Operating System: Ubuntu 22.04.2 LTS
 OSType: linux
 Architecture: x86_64
 CPUs: 224
 Total Memory: 1.968TiB

```

**Nvidia-smi (host)**

```
+-----------------------------------------------------------------------------------------+
| NVIDIA-SMI 570.124.06             Driver Version: 570.124.06     CUDA Version: 12.8     |
|-----------------------------------------+------------------------+----------------------+
| GPU  Name                 Persistence-M | Bus-Id          Disp.A | Volatile Uncorr. ECC |
| Fan  Temp   Perf          Pwr:Usage/Cap |           Memory-Usage | GPU-Util  Compute M. |
|                                         |                        |               MIG M. |
|=========================================+========================+======================|
|   0  NVIDIA H100 80GB HBM3          Off |   00000000:18:00.0 Off |                    0 |
| N/A   27C    P0             71W /  700W |       1MiB /  81559MiB |      0%      Default |
|                                         |                        |             Disabled |
+-----------------------------------------+------------------------+----------------------+
|   1  NVIDIA H100 80GB HBM3          Off |   00000000:2A:00.0 Off |                    0 |
| N/A   28C    P0             71W /  700W |       1MiB /  81559MiB |      0%      Default |
|                                         |                        |             Disabled |
+-----------------------------------------+------------------------+----------------------+
|   2  NVIDIA H100 80GB HBM3          Off |   00000000:3A:00.0 Off |                    0 |
| N/A   27C    P0             25W /  700W |       1MiB /  81559MiB |      0%      Default |
|                                         |                        |             Disabled |
+-----------------------------------------+------------------------+----------------------+
|   3  NVIDIA H100 80GB HBM3          Off |   00000000:5D:00.0 Off |                    0 |
| N/A   27C    P0             71W /  700W |       1MiB /  81559MiB |      0%      Default |
|                                         |                        |             Disabled |
+-----------------------------------------+------------------------+----------------------+
|   4  NVIDIA H100 80GB HBM3          Off |   00000000:9A:00.0 Off |                    0 |
| N/A   27C    P0             71W /  700W |       1MiB /  81559MiB |      0%      Default |
|                                         |                        |             Disabled |
+-----------------------------------------+------------------------+----------------------+
|   5  NVIDIA H100 80GB HBM3          Off |   00000000:AB:00.0 Off |                    0 |
| N/A   28C    P0             75W /  700W |       1MiB /  81559MiB |      0%      Default |
|                                         |                        |             Disabled |
+-----------------------------------------+------------------------+----------------------+
|   6  NVIDIA H100 80GB HBM3          Off |   00000000:BA:00.0 Off |                    0 |
| N/A   27C    P0             69W /  700W |       1MiB /  81559MiB |      0%      Default |
|                                         |                        |             Disabled |
+-----------------------------------------+------------------------+----------------------+
|   7  NVIDIA H100 80GB HBM3          Off |   00000000:DB:00.0 Off |                    0 |
| N/A   25C    P0             70W /  700W |       1MiB /  81559MiB |      0%      Default |
|                                         |                        |             Disabled |
+-----------------------------------------+------------------------+----------------------+
                                                                                         
+-----------------------------------------------------------------------------------------+
| Processes:                                                                              |
|  GPU   GI   CI              PID   Type   Process name                        GPU Memory |
|        ID   ID                                                               Usage      |
|=========================================================================================|
|  No running processes found                                                             |
+-----------------------------------------------------------------------------------------+
```

**check_env (inside container)**
```
Python: 3.12.3 (main, May 26 2025, 18:50:19) [GCC 13.3.0]
CUDA available: True
GPU 0,1,2,3,4,5,6,7: NVIDIA H100 80GB HBM3
GPU 0,1,2,3,4,5,6,7 Compute Capability: 9.0
CUDA_HOME: /usr/local/cuda
NVCC: Cuda compilation tools, release 12.6, V12.6.85
CUDA Driver Version: 570.124.06
PyTorch: 2.7.1+cu126
sglang: 0.4.7.post1
sgl_kernel: 0.1.9
flashinfer_python: 0.2.6.post1
triton: 3.3.1
transformers: 4.52.3
torchao: 0.9.0
numpy: 2.3.0
aiohttp: 3.12.13
fastapi: 0.115.12
hf_transfer: 0.1.9
huggingface_hub: 0.33.0
interegular: 0.3.3
modelscope: 1.27.0
orjson: 3.10.18
outlines: 0.1.11
packaging: 25.0
psutil: 7.0.0
pydantic: 2.11.7
python-multipart: 0.0.20
pyzmq: 27.0.0
uvicorn: 0.34.3
uvloop: 0.21.0
vllm: Module Not Found
xgrammar: 0.1.19
openai: 1.87.0
tiktoken: 0.9.0
anthropic: 0.54.0
litellm: 1.72.6
decord: 0.6.0
NVIDIA Topology: 
	GPU0	GPU1	GPU2	GPU3	GPU4	GPU5	GPU6	GPU7	NIC0	NIC1	NIC2	NIC3	NIC4	NIC5	NIC6	NIC7	NIC8	NIC9	CPU Affinity	NUMA Affinity	GPU NUMA ID
GPU0	 X 	NV18	NV18	NV18	NV18	NV18	NV18	NV18	PIX	SYS	SYS	NODE	SYS	SYS	SYS	SYS	SYS	SYS	0-23	0		N/A
GPU1	NV18	 X 	NV18	NV18	NV18	NV18	NV18	NV18	SYS	PIX	NODE	SYS	SYS	SYS	SYS	SYS	SYS	SYS	24-47	1		N/A
GPU2	NV18	NV18	 X 	NV18	NV18	NV18	NV18	NV18	SYS	NODE	PIX	SYS	SYS	SYS	SYS	SYS	SYS	SYS	24-47	1		N/A
GPU3	NV18	NV18	NV18	 X 	NV18	NV18	NV18	NV18	NODE	SYS	SYS	PIX	SYS	SYS	SYS	SYS	SYS	SYS	0-23	0		N/A
GPU4	NV18	NV18	NV18	NV18	 X 	NV18	NV18	NV18	SYS	SYS	SYS	SYS	PIX	SYS	SYS	SYS	SYS	NODE	48-71	2		N/A
GPU5	NV18	NV18	NV18	NV18	NV18	 X 	NV18	NV18	SYS	SYS	SYS	SYS	SYS	PIX	NODE	NODE	NODE	SYS	72-95	3		N/A
GPU6	NV18	NV18	NV18	NV18	NV18	NV18	 X 	NV18	SYS	SYS	SYS	SYS	SYS	NODE	PIX	NODE	NODE	SYS	72-95	3		N/A
GPU7	NV18	NV18	NV18	NV18	NV18	NV18	NV18	 X 	SYS	SYS	SYS	SYS	NODE	SYS	SYS	SYS	SYS	PIX	48-71	2		N/A
NIC0	PIX	SYS	SYS	NODE	SYS	SYS	SYS	SYS	 X 	SYS	SYS	NODE	SYS	SYS	SYS	SYS	SYS	SYS				
NIC1	SYS	PIX	NODE	SYS	SYS	SYS	SYS	SYS	SYS	 X 	NODE	SYS	SYS	SYS	SYS	SYS	SYS	SYS				
NIC2	SYS	NODE	PIX	SYS	SYS	SYS	SYS	SYS	SYS	NODE	 X 	SYS	SYS	SYS	SYS	SYS	SYS	SYS				
NIC3	NODE	SYS	SYS	PIX	SYS	SYS	SYS	SYS	NODE	SYS	SYS	 X 	SYS	SYS	SYS	SYS	SYS	SYS				
NIC4	SYS	SYS	SYS	SYS	PIX	SYS	SYS	NODE	SYS	SYS	SYS	SYS	 X 	SYS	SYS	SYS	SYS	NODE				
NIC5	SYS	SYS	SYS	SYS	SYS	PIX	NODE	SYS	SYS	SYS	SYS	SYS	SYS	 X 	NODE	NODE	NODE	SYS				
NIC6	SYS	SYS	SYS	SYS	SYS	NODE	PIX	SYS	SYS	SYS	SYS	SYS	SYS	NODE	 X 	NODE	NODE	SYS				
NIC7	SYS	SYS	SYS	SYS	SYS	NODE	NODE	SYS	SYS	SYS	SYS	SYS	SYS	NODE	NODE	 X 	PIX	SYS				
NIC8	SYS	SYS	SYS	SYS	SYS	NODE	NODE	SYS	SYS	SYS	SYS	SYS	SYS	NODE	NODE	PIX	 X 	SYS				
NIC9	SYS	SYS	SYS	SYS	NODE	SYS	SYS	PIX	SYS	SYS	SYS	SYS	NODE	SYS	SYS	SYS	SYS	 X 				

Legend:

  X    = Self
  SYS  = Connection traversing PCIe as well as the SMP interconnect between NUMA nodes (e.g., QPI/UPI)
  NODE = Connection traversing PCIe as well as the interconnect between PCIe Host Bridges within a NUMA node
  PHB  = Connection traversing PCIe as well as a PCIe Host Bridge (typically the CPU)
  PXB  = Connection traversing multiple PCIe bridges (without traversing the PCIe Host Bridge)
  PIX  = Connection traversing at most a single PCIe bridge
  NV#  = Connection traversing a bonded set of # NVLinks

NIC Legend:

  NIC0: mlx5_0
  NIC1: mlx5_1
  NIC2: mlx5_2
  NIC3: mlx5_3
  NIC4: mlx5_4
  NIC5: mlx5_5
  NIC6: mlx5_6
  NIC7: mlx5_7
  NIC8: mlx5_8
  NIC9: mlx5_9


ulimit soft: 2097152
```

### Node1

**Docker info**
```
Client: Docker Engine - Community
 Version:    28.2.2
 Context:    default
 Debug Mode: false
 Plugins:
  buildx: Docker Buildx (Docker Inc.)
    Version:  v0.24.0
    Path:     /usr/libexec/docker/cli-plugins/docker-buildx
  compose: Docker Compose (Docker Inc.)
    Version:  v2.36.2
    Path:     /usr/libexec/docker/cli-plugins/docker-compose

Server:
 Containers: 3
  Running: 0
  Paused: 0
  Stopped: 3
 Images: 3
 Server Version: 28.2.2
 Storage Driver: overlay2
  Backing Filesystem: extfs
  Supports d_type: true
  Using metacopy: false
  Native Overlay Diff: true
  userxattr: false
 Logging Driver: json-file
 Cgroup Driver: cgroupfs
 Cgroup Version: 1
 Plugins:
  Volume: local
  Network: bridge host ipvlan macvlan null overlay
  Log: awslogs fluentd gcplogs gelf journald json-file local splunk syslog
 CDI spec directories:
  /etc/cdi
  /var/run/cdi
 Swarm: inactive
 Runtimes: io.containerd.runc.v2 nvidia runc
 Default Runtime: nvidia
 Init Binary: docker-init
 containerd version: 05044ec0a9a75232cad458027ca83437aae3f4da
 runc version: v1.2.5-0-g59923ef
 init version: de40ad0
 Security Options:
  seccomp
   Profile: builtin
 Kernel Version: 5.15.179-15
 Operating System: Ubuntu 22.04.2 LTS
 OSType: linux
 Architecture: x86_64
 CPUs: 224
 Total Memory: 1.968TiB

```

**Nvidia-smi (host)**
```
+-----------------------------------------------------------------------------------------+
| NVIDIA-SMI 570.124.06             Driver Version: 570.124.06     CUDA Version: 12.8     |
|-----------------------------------------+------------------------+----------------------+
| GPU  Name                 Persistence-M | Bus-Id          Disp.A | Volatile Uncorr. ECC |
| Fan  Temp   Perf          Pwr:Usage/Cap |           Memory-Usage | GPU-Util  Compute M. |
|                                         |                        |               MIG M. |
|=========================================+========================+======================|
|   0  NVIDIA H100 80GB HBM3          Off |   00000000:0F:00.0 Off |                    0 |
| N/A   27C    P0             69W /  700W |       1MiB /  81559MiB |      0%      Default |
|                                         |                        |             Disabled |
+-----------------------------------------+------------------------+----------------------+
|   1  NVIDIA H100 80GB HBM3          Off |   00000000:34:00.0 Off |                    0 |
| N/A   25C    P0             69W /  700W |       1MiB /  81559MiB |      0%      Default |
|                                         |                        |             Disabled |
+-----------------------------------------+------------------------+----------------------+
|   2  NVIDIA H100 80GB HBM3          Off |   00000000:48:00.0 Off |                    0 |
| N/A   28C    P0             71W /  700W |       1MiB /  81559MiB |      0%      Default |
|                                         |                        |             Disabled |
+-----------------------------------------+------------------------+----------------------+
|   3  NVIDIA H100 80GB HBM3          Off |   00000000:5A:00.0 Off |                    0 |
| N/A   26C    P0             71W /  700W |       1MiB /  81559MiB |      0%      Default |
|                                         |                        |             Disabled |
+-----------------------------------------+------------------------+----------------------+
|   4  NVIDIA H100 80GB HBM3          Off |   00000000:87:00.0 Off |                    0 |
| N/A   30C    P0             70W /  700W |       1MiB /  81559MiB |      0%      Default |
|                                         |                        |             Disabled |
+-----------------------------------------+------------------------+----------------------+
|   5  NVIDIA H100 80GB HBM3          Off |   00000000:AE:00.0 Off |                    0 |
| N/A   26C    P0             70W /  700W |       1MiB /  81559MiB |      0%      Default |
|                                         |                        |             Disabled |
+-----------------------------------------+------------------------+----------------------+
|   6  NVIDIA H100 80GB HBM3          Off |   00000000:C2:00.0 Off |                    0 |
| N/A   28C    P0             70W /  700W |       1MiB /  81559MiB |      0%      Default |
|                                         |                        |             Disabled |
+-----------------------------------------+------------------------+----------------------+
|   7  NVIDIA H100 80GB HBM3          Off |   00000000:D7:00.0 Off |                    0 |
| N/A   26C    P0             71W /  700W |       1MiB /  81559MiB |      0%      Default |
|                                         |                        |             Disabled |
+-----------------------------------------+------------------------+----------------------+
                                                                                         
+-----------------------------------------------------------------------------------------+
| Processes:                                                                              |
|  GPU   GI   CI              PID   Type   Process name                        GPU Memory |
|        ID   ID                                                               Usage      |
|=========================================================================================|
|  No running processes found                                                             |
+-----------------------------------------------------------------------------------------+
```

**check-env (in the container)**
```
Python: 3.12.3 (main, May 26 2025, 18:50:19) [GCC 13.3.0]
CUDA available: True
GPU 0,1,2,3,4,5,6,7: NVIDIA H100 80GB HBM3
GPU 0,1,2,3,4,5,6,7 Compute Capability: 9.0
CUDA_HOME: /usr/local/cuda
NVCC: Cuda compilation tools, release 12.6, V12.6.85
CUDA Driver Version: 570.124.06
PyTorch: 2.7.1+cu126
sglang: 0.4.7.post1
sgl_kernel: 0.1.9
flashinfer_python: 0.2.6.post1
triton: 3.3.1
transformers: 4.52.3
torchao: 0.9.0
numpy: 2.3.0
aiohttp: 3.12.13
fastapi: 0.115.12
hf_transfer: 0.1.9
huggingface_hub: 0.33.0
interegular: 0.3.3
modelscope: 1.27.0
orjson: 3.10.18
outlines: 0.1.11
packaging: 25.0
psutil: 7.0.0
pydantic: 2.11.7
python-multipart: 0.0.20
pyzmq: 27.0.0
uvicorn: 0.34.3
uvloop: 0.21.0
vllm: Module Not Found
xgrammar: 0.1.19
openai: 1.87.0
tiktoken: 0.9.0
anthropic: 0.54.0
litellm: 1.72.6
decord: 0.6.0
NVIDIA Topology: 
	GPU0	GPU1	GPU2	GPU3	GPU4	GPU5	GPU6	GPU7	NIC0	NIC1	NIC2	NIC3	NIC4	NIC5	NIC6	NIC7	NIC8	NIC9	CPU Affinity	NUMA Affinity	GPU NUMA ID
GPU0	 X 	NV18	NV18	NV18	NV18	NV18	NV18	NV18	PIX	NODE	NODE	NODE	SYS	SYS	SYS	SYS	SYS	SYS	0-55,112-167	0		N/A
GPU1	NV18	 X 	NV18	NV18	NV18	NV18	NV18	NV18	NODE	PIX	NODE	NODE	SYS	SYS	SYS	SYS	SYS	SYS	0-55,112-167	0		N/A
GPU2	NV18	NV18	 X 	NV18	NV18	NV18	NV18	NV18	NODE	NODE	PIX	NODE	SYS	SYS	SYS	SYS	SYS	SYS	0-55,112-167	0		N/A
GPU3	NV18	NV18	NV18	 X 	NV18	NV18	NV18	NV18	NODE	NODE	NODE	PIX	SYS	SYS	SYS	SYS	SYS	SYS	0-55,112-167	0		N/A
GPU4	NV18	NV18	NV18	NV18	 X 	NV18	NV18	NV18	SYS	SYS	SYS	SYS	PIX	NODE	NODE	NODE	NODE	NODE	56-111,168-223	1		N/A
GPU5	NV18	NV18	NV18	NV18	NV18	 X 	NV18	NV18	SYS	SYS	SYS	SYS	NODE	NODE	NODE	PIX	NODE	NODE	56-111,168-223	1		N/A
GPU6	NV18	NV18	NV18	NV18	NV18	NV18	 X 	NV18	SYS	SYS	SYS	SYS	NODE	NODE	NODE	NODE	PIX	NODE	56-111,168-223	1		N/A
GPU7	NV18	NV18	NV18	NV18	NV18	NV18	NV18	 X 	SYS	SYS	SYS	SYS	NODE	NODE	NODE	NODE	NODE	PIX	56-111,168-223	1		N/A
NIC0	PIX	NODE	NODE	NODE	SYS	SYS	SYS	SYS	 X 	NODE	NODE	NODE	SYS	SYS	SYS	SYS	SYS	SYS				
NIC1	NODE	PIX	NODE	NODE	SYS	SYS	SYS	SYS	NODE	 X 	NODE	NODE	SYS	SYS	SYS	SYS	SYS	SYS				
NIC2	NODE	NODE	PIX	NODE	SYS	SYS	SYS	SYS	NODE	NODE	 X 	NODE	SYS	SYS	SYS	SYS	SYS	SYS				
NIC3	NODE	NODE	NODE	PIX	SYS	SYS	SYS	SYS	NODE	NODE	NODE	 X 	SYS	SYS	SYS	SYS	SYS	SYS				
NIC4	SYS	SYS	SYS	SYS	PIX	NODE	NODE	NODE	SYS	SYS	SYS	SYS	 X 	NODE	NODE	NODE	NODE	NODE				
NIC5	SYS	SYS	SYS	SYS	NODE	NODE	NODE	NODE	SYS	SYS	SYS	SYS	NODE	 X 	PIX	NODE	NODE	NODE				
NIC6	SYS	SYS	SYS	SYS	NODE	NODE	NODE	NODE	SYS	SYS	SYS	SYS	NODE	PIX	 X 	NODE	NODE	NODE				
NIC7	SYS	SYS	SYS	SYS	NODE	PIX	NODE	NODE	SYS	SYS	SYS	SYS	NODE	NODE	NODE	 X 	NODE	NODE				
NIC8	SYS	SYS	SYS	SYS	NODE	NODE	PIX	NODE	SYS	SYS	SYS	SYS	NODE	NODE	NODE	NODE	 X 	NODE				
NIC9	SYS	SYS	SYS	SYS	NODE	NODE	NODE	PIX	SYS	SYS	SYS	SYS	NODE	NODE	NODE	NODE	NODE	 X 				

Legend:

  X    = Self
  SYS  = Connection traversing PCIe as well as the SMP interconnect between NUMA nodes (e.g., QPI/UPI)
  NODE = Connection traversing PCIe as well as the interconnect between PCIe Host Bridges within a NUMA node
  PHB  = Connection traversing PCIe as well as a PCIe Host Bridge (typically the CPU)
  PXB  = Connection traversing multiple PCIe bridges (without traversing the PCIe Host Bridge)
  PIX  = Connection traversing at most a single PCIe bridge
  NV#  = Connection traversing a bonded set of # NVLinks

NIC Legend:

  NIC0: mlx5_0
  NIC1: mlx5_1
  NIC2: mlx5_2
  NIC3: mlx5_3
  NIC4: mlx5_4
  NIC5: mlx5_5
  NIC6: mlx5_6
  NIC7: mlx5_7
  NIC8: mlx5_8
  NIC9: mlx5_9


ulimit soft: 2097152
```

**Comment by SzymonOzog** [comment]
Hey, I had similar issues. For me it was caused by GPU Direct RDMA not working properly on my system. Disabling ACS https://docs.nvidia.com/deeplearning/nccl/user-guide/docs/troubleshooting.html#pci-access-control-services-acs resolved it for me. Another solution was disabling GDR `NCCL_NET_GDR_LEVEL=0` but it gave much worse performance

**Comment by human-research** [comment]
Hello all, 
the issue was resolved with:
- downgrade 570 to 560 driver
- using v0.4.6.post1-cu125 instead of v0.4.7.post1-cu124

Looks like driver version and suitable cuda should be matched for pytorch in the image.
